headline,short_description,cluster,event_label,date
Thursday's Morning Email: Judge halts Trump's travel ban,TOP STORIES (And want to get The Morning Email each weekday? Sign up here.) NOTE TO MORNING EMAIL READERS: Lauren Weber is,7,International Politics,2017-03-16
Not Even He Can Mess This Up,The revolution is already happening.,7,International Politics,2017-02-21
Transgender Americans Can Now Fight And Die For A Country That Doesn't Protect Them At Home,There is still no federal law barring workplace discrimination on the basis of sexual orientation and gender identity.,2,Social Issues and Public Safety,2016-06-30
'Mean Girls' Star Jonathan Bennett Marries Jaymes Vaughan In Mexico,"The two men made it official in a stunning beach ceremony that included a fireworks display set to the soundtrack of ""The Greatest Showman.""",0,Entertainment and Celebrities,2022-03-21
"For the Best Breakfasts, Look to Our Neighbors",The benefits of breakfast are almost too numerous to list. I find that more and more people now know that they should eat breakfast -- but they still ask me what to eat. My advice is to eat traditional foods.,4,Food Home and Lifestyle,2012-04-27
The Arctic: A Journey Of Epic Proportions,Each day of the journey brought unpredictable thrills and excitement. And it wasn't just the landscapes that floored me.,3,Self Help and Education,2012-03-24
Chuck Schumer Trolls GOP Over Donald Trump's Comparison Of America To Vladimir Putin,"“Where are you? You know if a Democrat said it, you’d be just howling at the moon,"" he said.",7,International Politics,2017-02-06
The Best Restaurant In The World Is Not What You're Thinking,"Guess again, folks.",4,Food Home and Lifestyle,2016-06-15
The Snowden Effect,For well over half a century the U.S. has depended on its Intelligence Community as the first line of defense in meeting,7,International Politics,2017-03-11
Racing to Win: The Conquest of the South Pole,"Last week, as 52 passengers were rescued from a ship stuck in Antarctic ice for 10 days, I was reminded of an earlier expedition to the dangerous, seductive and, at the time, largely unchartered continent of Antarctica: the race to discover the South Pole.",9,World Events and Society,2014-01-11
Harden Drops 43 Leads Rockets Past Kings,James Harden is no Stephen Curry but the runner up MVP is making noise as he gets his Rockets back on track in the West.,9,World Events and Society,2015-11-07
Jessica Alba And Chrissy Teigen Are Gorgeous Beach Babes,,1,Fashion Lifestyle and Travel,2015-03-27
Spice Up Small Spaces With These Expert Tips,We see a lot of small space problems... and come up with even more solutions.,4,Food Home and Lifestyle,2012-10-24
Human Chain Pulls Dog Out Of Deep Channel In Heartwarming Rescue,A little video reminder that people really are good.,0,Entertainment and Celebrities,2016-06-14
8 Things It Took Parenthood to Teach Me About My Own Parents,"It's taken 30+ years of life, marriage and two kids to really understand what my parents have done -- and are still doing -- for me. Here are a few of the decisions, actions and sacrifices they made that I only comprehended after becoming a parent myself.",8,Family Children and Human Stories,2014-10-10
"Anti-Charlie Hebdo Rally In Pakistan Draws 5,000 People",,9,World Events and Society,2015-01-18
Parents: Teach Your High School Kids About Money,"As your kids move forward on their road to independence, the lessons build upon the foundation of principles you have helped them build -- and address the real-life situations and obstacles they will encounter.",8,Family Children and Human Stories,2014-01-29
Laurensia Swandito's GPS Guide On Forgetting Troubles Before Bed,Let them go.,3,Self Help and Education,2016-03-25
When Photography Becomes More Than Just Taking Pictures,"We wanted to take the best photograph ever taken in Myanmar.   My guide, MM, and I were tired of the same stale images being photographed of his country over and over.  We felt we could do something better and if not better at least more original. Of course we are as guilty as all the other photographers that took the same tried and true photographs, great images initially but ones that were starting to bore us.",1,Fashion Lifestyle and Travel,2015-02-17
Gardner's Fake Schedule Conflict?,Monger was featured in a Healthier Colorado advertisement opposing the U.S. Senate’s bill to replace Obamacare.,5,US Politics,2017-07-14
Teen Romance and the Romeo and Juliet Effect,Is it normal for a 13-year-old boy to be expressing love at such a young age?,8,Family Children and Human Stories,2012-06-15
Stunning New Charon Photos Reveal Pluto Moon's Violent Past,"Craters, sure, but Charon's surface also features mountains, landslides, and a gigantic canyon.",1,Fashion Lifestyle and Travel,2015-10-02
Dutee Chand Scores Important Victory For Hyperandrogenic Female Athletes,Sport's highest court has suspended IAAF rules governing women who have high levels of male hormones.,6,Women Relationships and Health,2015-07-27
The Health Hazards Of Sitting,"We know sitting too much is bad, and most of us intuitively feel a little guilty after a long TV binge. But what exactly",3,Self Help and Education,2014-01-22
Uber To Pull App Feature That Tracked Riders After Their Trips Ended,The change is in response to users and privacy advocates who complained about how the company collected its data.,9,World Events and Society,2017-08-29
Britney Spears Shares Abs-olutely Silly Selfie,"Mirror mirror, off the wall.",1,Fashion Lifestyle and Travel,2017-01-27
This Gluten-Free Thing Is a Really Overblown Fad!,"For many people, a ""gluten-free"" label unfortunately bestows a cachet of health onto whatever processed food it graces. Potato chips? They're gluten-free! Triple-chocolate brownie mud slide?  Eat without guilt! Of course, you don't actually need gluten-free products to go gluten-free.",4,Food Home and Lifestyle,2013-09-05
60 Years Of Jane Doe Portraits Give Nameless Women The Attention They Deserve,,1,Fashion Lifestyle and Travel,2015-03-28
What Does 'Black-On-Black Crime' Have to Do With Ferguson?,"No matter how ""respectable"" we are or become, as long as our skin is Black we will never amount to white standards though we are expected to be a reflection of them. Respectability will never be a solution because the issue isn't us; it's how white America views blackness.",2,Social Issues and Public Safety,2014-11-30
Rolling Stone Awaits Review Of Debunked UVA Gang Rape Story,,2,Social Issues and Public Safety,2015-04-04
Jeb's Claim Of His Florida Boom Economy Has A Big Problem,"BOCA RATON, Fla. — On the campaign trail, Jeb Bush has repeatedly emphasized his record overseeing Florida’s boom economy",5,US Politics,2015-07-28
These Are The Dresses The Stars Should Have Worn To The Emmys (PHOTOS),Lena Dunham --> Temperley London Alyson Hannigan --> Delpozo January Jones --> Cushnie et Ochs If she's not in a wedding,1,Fashion Lifestyle and Travel,2013-09-23
Pete Buttigieg Reveals New Plan To Expand Rights For People With Disabilities,"The proposals include ending a minimum wage loophole, improving education for disabled students and implementing Social Security reforms.",9,World Events and Society,2019-11-02
AOC Gave The Most Important Feminist Speech In A Generation,Rep. Alexandria Ocasio-Cortez's remarks were an eloquent dismantling of the playbook men have used to keep women in their place for centuries.,6,Women Relationships and Health,2020-07-24
Ending the Life of a Pet,"This afternoon, my dog will leave this world in my arms without pain, with my lipstick kiss on her mature Maltese mane.  Tonight, when it is late and dark and time to sleep, I will feel her presence beside me.",3,Self Help and Education,2013-01-30
Kid Rock Out As Grand Marshall Of Nashville's Christmas Parade Over Joy Behar Slur,Kid Rock is being replaced with Waffle House shooting hero James Shaw Jr. after the country rapper used an expletive to refer to Joy Behar.,0,Entertainment and Celebrities,2018-12-01
5 Cops Busted Lying on the Stand: Just Another Day on the Front Lines,"When we discover that a police officer has lied, it raises serious questions and concerns. For every falsehood uncovered, how often does one go unnoticed? How often do an officer's lies end up becoming damning evidence against a defendant?",2,Social Issues and Public Safety,2014-04-30
"Trans Employee Sues McDonald's For 'Extreme Sexual Harassment,' Discrimination",La’Ray Reed says she was fired after complaining about the abuse to managers.,2,Social Issues and Public Safety,2017-06-17
A Conversation With Decorator Ellie Cullman,"Cullman pauses from the many milestones of her career to talk about female empowerment, skin regimens and Raisinettes.",6,Women Relationships and Health,2013-10-22
Common Salad Mistakes,"Whatever you do, take it easy with the dressing.",4,Food Home and Lifestyle,2013-05-13
"NASA's Asteroid Capture Mission Flooded With Ideas From Private Companies, Non-Profits",Wildest Private Deep-Space Mission Ideas: A Countdown How to Catch an Asteroid: NASA Mission Explained (Infographic) Animation,9,World Events and Society,2013-07-28
Let’s Reduce Loss Of Life From Irma,Every effort must be made in the coming days to ensure that warnings reach the most marginalised and vulnerable.,9,World Events and Society,2017-09-06
How to Make the Perfect Boozy Punch for the Holidays,We love recipes -- but do we always use them? Of course not. Kenzi Wilbur shows us how to make boozy party punch with whatever is lingering in your liquor cabinet.,4,Food Home and Lifestyle,2013-12-21
Democrats Are Divided On Whether To Let Felons Vote In Prison,"Americans favor letting people vote once they finish their sentences, but are much more hesitant about letting them vote while incarcerated.",5,US Politics,2019-05-31
Bill Maher: Liberty University Is Not A Real School,"Romney delivered Liberty's commencement speech on May 12. At the end of ""Real Time"" Friday night, Bill Maher lambasted Liberty",5,US Politics,2012-05-20
Thieving Magpie Steals Joint From Man,A magpie in Germany got a pot smoker all out of joint when the bird stole the spliff the guy was smoking.,2,Social Issues and Public Safety,2015-07-21
Super Bowl Fans: Cutest Babies And Kids In Jerseys,"Forget the practicing, the training, or the strategizing -- even football players themselves know their littlest fans are",8,Family Children and Human Stories,2012-02-04
Black Poet Explains Painful Reality Of Police Violence To His 4-Year-Old Nephew,The harsh truth that every black child eventually has to hear.,2,Social Issues and Public Safety,2015-11-13
There's A Mistake In 'Straight Outta Compton' You Probably Didn't Notice,See anything wrong with the White Sox hat?,2,Social Issues and Public Safety,2015-08-19
'Coco' Producer Says A Queer Pixar Protagonist Would Be 'A Dream',"The film's success will encourage diversity ""in every realm,"" she said.",0,Entertainment and Celebrities,2018-03-07
7 Lessons I've Learnt Traveling Solo As A Hijabi,"Instead of being a hindrance, my hijab has led to many wonderful conversations about faith, religion and humanity.",3,Self Help and Education,2017-10-28
"Kids Explain The National Anthem, Aren't Clear On What Ramparts Are (VIDEO)","We are ""proudly to all of the states and the uniteds"" after declaring independence from Canada, according to the cute kids",8,Family Children and Human Stories,2013-07-04
A Cancer Patient's Guide to Wedding Planning,"Planning a wedding is an expensive and logistically complicated undertaking, and it is often the first (and only) large party you will throw. But you should never feel inferior, whether it's because you are in a wheelchair, can't afford a photobooth, or simply don't give a damn about the centerpieces.",3,Self Help and Education,2014-02-26
The Strangest Hotel Butlers Around the World,"A fireplace butler? A fragrance concierge? They're real, and you'll find them -- plus plenty of other super-specific assistants -- at hotels around the world...",1,Fashion Lifestyle and Travel,2013-09-11
The Road to Everywhere: Why You Can't Put Off That Trip Any Longer,I didn't exactly know what to do with my dad's Elantra. So I drove. I got in the car and took my first independent road trip. It was the only thing I could do to both honor my dad and escape the overwhelming pain and death at home.,3,Self Help and Education,2014-03-06
Stephen Fry Spared Blasphemy Charges Over Calling God A ‘Maniac’: Report,Police in Ireland said they were unable to find enough people outraged over his remarks made in 2015.,2,Social Issues and Public Safety,2017-05-09
Keeping Things In Perspective In Youth Sports,"When done right, athletics can offer a lot of positives.",3,Self Help and Education,2016-11-28
Get Corporations Out of Politics: Ciara Torres-Spelliscy,,5,US Politics,2016-09-18
What's A Twitter Roundup Without Chrissy Teigen?,"This week, our Twitter feed wasn't inundated with New York Fashion Week updates... and we're okay with it. That being said",1,Fashion Lifestyle and Travel,2014-02-22
Miss Grinch,"Are you excited for Christmas this year? Or are you like me, dragging your feet? It seems like Thanksgiving barely happened",0,Entertainment and Celebrities,2012-12-12
GOP Congressman Has A Wish List Of Trump Alternatives,It's a nice list! But it's far too late.,5,US Politics,2016-10-09
Pro-Immigration Reform Republicans To Donald Trump: Told You So,The GOP nominee is adopting some talking points that sound surprisingly familiar.,5,US Politics,2016-08-25
Why This Woman Who Cast An Illegal Vote For Donald Trump Is Getting A Pass For Voter Fraud,"“This woman is 67 years old and has never run afoul of the law for anything more serious than a speeding ticket.""",5,US Politics,2017-04-27
The Internet Won't Get Behind This Half-Assed Fashion Choice (NSFW),Is this person wearing pants?,1,Fashion Lifestyle and Travel,2015-12-11
5 Workout Mantras That Are Bad For Your Body,"By Jessica Smith We asked Elizabeth Lombardo, Ph.D., a psychologist, physical therapist and author of A Happy You: Your Ultimate",3,Self Help and Education,2012-11-13
Your ROI on Safety: Keep Your Health Safe With Preventive Screenings,"Getting used to regular health screenings sets the foundation for your future well-being. The older we get, the more critical it becomes.",3,Self Help and Education,2014-02-18
"Kesha Reaffirms She's Down But Not Out, Still Writing New Music",Maybe one day she'll get a chance to release it.,0,Entertainment and Celebrities,2016-03-24
Carrie Underwood Is A Style Chameleon At American Country Countdown Awards,The country singer can do no wrong.,0,Entertainment and Celebrities,2016-05-02
Justin Timberlake's 'Can't Stop The Feeling' Is The Song Of The Summer,"Get ready to ""dance, dance, dance.""",0,Entertainment and Celebrities,2016-05-06
Party Your Way Into Your Wedding Dress,"Women who learn to let ""fun"" fuel their weight loss feel more beautiful, sexy and confident, lose more weight than dieters AND have a life full of passion, romance, relaxation and purpose.",4,Food Home and Lifestyle,2012-02-24
"5 Lessons From Honor Blackman, 86-Year-Old Bond Girl (PHOTOS)","So, why is Blackman still self-conscious? Take a peek at our gallery below to find out and head over to Telegraph.co.uk for",1,Fashion Lifestyle and Travel,2012-08-28
Obama: Climate Change Trends Are 'Terrifying',"“It’s a slow-moving issue that, on a day-to-day basis, people don’t experience and don’t see.”",5,US Politics,2016-09-08
You Think You Have It Bad? Here's One Of The Snowiest Places On Earth,"On the northern part of the main island of Honshu sits the city of Aomori. Head a bit south and you get to Sukayu Onsen, a",9,World Events and Society,2014-02-13
Victoria's Secret Fashion Show 2013 Stars Taylor Swift Giving The Angels Competition (PHOTOS),"But the show was, as always, about the models. Candice Swanepoel, the lucky Angel chosen to wear this year's $10 million",1,Fashion Lifestyle and Travel,2013-11-14
Why Jeff Sessions Hates Stoners (Or Secretly Loves Them),The attorney general's coffers are lined by many who stand to benefit from incarcerating cannabis users.,2,Social Issues and Public Safety,2018-01-05
"This World Heart Day, 'Share The Power' -- Learn CPR, How To Use An AED","However, less than half of the 350,000-plus Americans who experience a cardiac arrest outside a hospital each year receive",9,World Events and Society,2017-09-29
The Battle for Soft Power: America's Digital Cold War with China,"Talk these days of the creative economy as soft power and a harbinger of world peace, ignores the huge struggles taking place between Google, Facebook no one hand and Baidu, We Chat, Tencent on the other, pitching the U.S. and China directly against each other in a cold digital war of online platforms, search engines and aggregation algorithms. It is very nice to assert the diversity of cultures in a globalized world. But this diversity is in reality dependent on some very hard issues of finance, intellectual property rights and communications infrastructures.",7,International Politics,2014-06-23
'The Patriot' Actress Skye McCole Bartusiak Dead At 21,,0,Entertainment and Celebrities,2014-07-20
American Food: Classic Recipes From The USA,"It's difficult to define American food, to say that dish x is the best representation of an entire country that's so expansive",4,Food Home and Lifestyle,2012-06-28
Republicans Use Abortion Fight To Jam Loretta Lynch Nomination,,5,US Politics,2015-04-16
Donald Trump's Unrequited Love Affair With The Huffington Post,"Uhhh, this is awkward.",7,International Politics,2016-02-04
Daily Meditation: Deliver Us,"We all need help maintaining our personal spiritual practice. We hope that these Daily Meditations, prayers and mindful awareness",3,Self Help and Education,2016-02-15
LGBTQ March On Washington Joins Forces With Major Pride Festival,Members of the community are ready to stand up for their rights in the Donald Trump era.,2,Social Issues and Public Safety,2017-01-27
4 Things That Make the Difference Between Surviving and Thriving,"In light of those things we cannot change, it makes sense that we would do everything in our power to choose habits that will serve to strengthen our ability to bounce back in difficult times.",3,Self Help and Education,2014-01-27
Wedding Nails: Inspiration For Every Bride (PHOTOS),If you've browsed through Pinterest or Instagram any time in the last year you'll know that nail art is huge. Really huge,1,Fashion Lifestyle and Travel,2013-06-05
Best Restaurants for Easter Brunch in NYC,"Whether you've given up sweets, savory delicacies, and lavish meals out for Lent or not, a delicious Easter brunch is the perfect way to celebrate the holiday.",4,Food Home and Lifestyle,2014-04-15
Barber Who Slashed Customer's Throat Heads To Prison,,2,Social Issues and Public Safety,2015-06-12
John Oliver Shreds Pharmaceutical Industry Over America's Massive Opioid Crisis,Part of the problem: Alternative options for pain aren’t always available or covered by insurance.,9,World Events and Society,2016-10-24
Donald Trump Promised To Give Trump Vodka Proceeds To Charity -- But Never Did,"The donation, Trump said, was in ""honor of my late brother, Fred Trump.""",7,International Politics,2016-06-07
Sleep Stages: What Happens During Sleep?,"We do know that these different functions seem to take place during different phases of the night, although there's no one",3,Self Help and Education,2012-02-27
Unusual Island Vacations (PHOTOS),It's getting warmer as summer approaches and we've got a full-blown case of spring fever. We keep catching ourselves dreaming,1,Fashion Lifestyle and Travel,2012-05-08
Fabulous Fiji,"There's so much to do here, if catching a tan is not your cup of tea; sailing, fishing, scuba diving the colorful coral reefs, yoga in the morning on the beach and of course... the spa.",4,Food Home and Lifestyle,2015-05-06
Did George Bush Really Write That Book About His Father?,"All over the country, newspaper reviewers are wasting space reviewing George Bush's biography about his father.  Whether they pan it or praise it, they'll say over and over, as Michiko Kakutani recently did in The New York Times, things like ""he writes--"" or ""he says--"" Does he?",7,International Politics,2014-11-15
I Am NOT A Summertime Mom,"I love the idea of summer, but with four children, the reality of it is never quite like I imagine.",8,Family Children and Human Stories,2017-07-25
Drawing for the Soul,"My very favorite time to draw is in the evening.  I like to settle into my comfy chair with a clip board, lots of paper and pencils jammed conveniently in my hair.  The movement of the pencil on the paper is rather hypnotic, and before I know it, hours have gone by.",3,Self Help and Education,2012-07-27
The Shocking Way A Mother And Daughter Communicate,"Beth, 22, claims she grew up in a ""house of horrors"" filled with unbelievable acts of abuse and neglect, allegedly at the",8,Family Children and Human Stories,2015-08-20
"Boy Scouts Mislead and Exclude With BMI Policy, and There's a Better Way","The Boy Scouts have been in the news again for exclusionary practices, this time not for sexual orientation, but for body mass index cutoffs for their Jamboree.",6,Women Relationships and Health,2013-07-19
This Judge Isn't Buying The Trump Admin's Excuses For Holding A U.S. Citizen 'Incommunicado',"“What the government is suggesting is an end run around the right to habeas,"" said U.S. District Judge Tanya Chutkan.",5,US Politics,2017-12-11
Black Jews: 10 Celebrities You Didn't Know Were Jewish,"What do Drake, Sammy Davis Jr. and Adam Sandler have in common? These three men share more than just fame and good looks",0,Entertainment and Celebrities,2012-12-16
Dog & River Otter Play: Cute/Ridiculous Animal Thing Of The Day (VIDEO),"We especially love how the otter effortlessly jumps back and forth through the fence, and even pretends to leave at one point",0,Entertainment and Celebrities,2012-03-18
March Madness Watchers To Cost Businesses $134 Million In Just The First Two Days: Study,"Despite the apparent prevalence of tournament watching, Challenger said employers are making a good, albeit expensive, long",9,World Events and Society,2013-03-17
14 Books To Help Kids Get Ready For The New School Year,"Whatever the transition your child is facing, we hope a few of these books might help ease their fears.",8,Family Children and Human Stories,2017-07-28
Jason Wu's Cat Has Us Dreaming Of Kitty Couture (PHOTOS),Fashion's obsession with animals is nothing new. Years ago Stella McCartney put horses on pieces in her spring 2001 collection,1,Fashion Lifestyle and Travel,2012-02-02
Patriotic Styles for American Holidays,"Fireworks, BBQs, and parades... all just some of the ways we love to celebrate America! From President's Day to Veteran's Day, here's a list of patriotic apparel to get you looking and feeling all-American when honoring and celebrating this great country!",1,Fashion Lifestyle and Travel,2013-07-05
Joe Donnelly Becomes Third Democratic Senator To Back Neil Gorsuch,Inching closer to 60 votes.,5,US Politics,2017-04-02
New Year's Quotes: Inspirational Sayings To Inspire A Fresh Start,"“Cheers to a new year and another chance for us to get it right,"" Oprah once toasted. Her words continue to ring true: This",3,Self Help and Education,2012-12-31
"Facebook, Twitter Finally Remove Trump Posts For Encouraging Violent Mob","Twitter said Trump's account would be locked for 12 hours after ""repeated and severe"" violations of its policies. Facebook imposed a 24-hour block.",2,Social Issues and Public Safety,2021-01-07
Ashley Greene On The Importance Of No Makeup And Crunchy Teenage Hair (PHOTOS),"But like the rest of us, she's had some regrettable hair moments My hair's been every color under the sun, and some are good",1,Fashion Lifestyle and Travel,2012-04-17
'Flat-Chested' And More Things Not To Say To Small-Busted Women (PHOTOS),"""Have you ever considered implants?""",1,Fashion Lifestyle and Travel,2013-02-19
Ellen DeGeneres Responds To Caitlyn Jenner's Comments About Marriage Equality,"""I want her to be happy -- which is what I want for her [to want] for me.""",6,Women Relationships and Health,2015-09-08
Republicans Wage Last-Minute Campaign To Undermine Net Neutrality Rules,,5,US Politics,2015-01-22
The Veep and Me,"I'm at a time in my life when I'm obsessed with minimizing future regrets and, to that end, I feel compelled to agree to just about any experience. How else do I explain saying yes to being a driver in a motorcade for Vice President Biden, being handed the keys to a 15 passenger vehicle and chauffeuring around a bunch of his 20-something staffers and some local journalists?",3,Self Help and Education,2015-05-01
"Marble Statue Looks Exactly Like Ron Swanson, But Was Carved In Mid-1800s",,1,Fashion Lifestyle and Travel,2014-07-16
Do You Compare Yourself to Others?,"The more you learn to love and value your unique essence, the less you will find yourself comparing yourself to others. There is only one you. You are incomparable!",3,Self Help and Education,2013-03-12
"Recyclable Materials: How Many Times You Can Reuse Aluminum, Paper, Glass And More","From Earth911's Kathryn Sukalich: If you have curbside pickup for recyclables at your home, you probably have a general idea",9,World Events and Society,2012-11-24
Roasted Cauliflower with (or without) Tahini Dressing,Roasted Cauliflower The great thing about this recipe is that the cauliflower by itself is totally yum and goes great with,4,Food Home and Lifestyle,2013-03-06
"A Love Letter To Louise Bourgeois, A Feminist Icon Whether She Likes It Or Not",,6,Women Relationships and Health,2014-07-19
