headline,short_description,cluster,event_label,date
What If We Were All Family Generation Changers?,"What if, in doing so, we won't just create new opportunities for ourselves, we'll also uncover ways to create new opportunities for our families that may not have otherwise existed?",8,Family Children and Human Stories,2014-06-20
Firestorm At AOL Over Employee Benefit Cuts,"It should have been a glorious week for AOL chief executive Tim Armstrong. His company’s quarterly earnings, announced Thursday",9,World Events and Society,2014-02-08
Dakota Access Protesters Arrested As Deadline Passes To Depart Camp,A few protesters who refused to leave remained at the site Thursday.,2,Social Issues and Public Safety,2017-02-22
One Glimpse Of These Baby Kit Foxes And You'll Be Hooked,,8,Family Children and Human Stories,2014-05-14
"Mens' Sweat Pheromone, Androstadienone, Influences Cooperation In Other Men","Scientists didn't know if humans played that game as well. But in the last 30 years, they've identified both male and female",6,Women Relationships and Health,2013-06-02
Summer Sleepover Tips,Here are five ways to get some beauty sleep while hosting a sleepover for your child.,4,Food Home and Lifestyle,2012-07-25
End of the Year,"For a moment, let yourself wonder -- and let your mind wander -- about what you've been a part of this year. All of these things, and more, are things that could offer you an opportunity to improve your performance.",3,Self Help and Education,2012-11-04
Maybe Colleges Should Take A Lesson From Zoos,"By Michael Preston, UCF Forum columnist What would it take to create a more learning-efficient campus? What elements must",3,Self Help and Education,2017-05-10
Supermodel Stephanie Seymour Does Sexy Photo Shoot...With Her Sons (PHOTO),"In particular, Seymour remembers the way the boys used to dress her up. ""When they were little, they would lay out outfits",1,Fashion Lifestyle and Travel,2014-02-10
"American Attitudes About Guns Have Become Much More Positive, But Why?","When I was a kid growing up in Washington, D.C. during the 1950s, my two favorite places to visit were the NRA Museum and",2,Social Issues and Public Safety,2017-07-27
Carl Bernstein: No Way Is Clinton Email Investigation 'Bigger Than Watergate',"He said this news is in a ""different league.""",7,International Politics,2016-10-29
NC Official Changes Stance On Pepper Spray In Trans-Friendly School Bathrooms (UPDATE),"""Perverts and pedophiles taking advantage of this law in bathrooms was my major concern,"" Chuck Hughes said.",2,Social Issues and Public Safety,2016-05-11
6 Tips That Could Help Your Student Loan Repayment,Finding ways to help save on your student loan repayment can save a lot of time and stress when managing your student loans. Take the time to clarify these commonly misunderstood repayment strategies.,3,Self Help and Education,2015-07-04
North Korea's Racial Slur of President Obama Is Business as Usual,"It's hardly the first time that some official or official source in North Korea has gotten caught with its racial dirty linen waving. The verbal war is the outcrop of the deep suspicion, distrust, antagonism, and confrontation that's characterized relations between the U.S. and North Korea for decades.",7,International Politics,2014-12-28
"If This Isn't The Most Charming Way To Travel, We Don't Know What Is",,4,Food Home and Lifestyle,2014-09-21
Why Women Stay in Bad Marriages,"Few people ""want"" to get divorced. It can be incredibly difficult and painful. As a result, an extraordinary amount of women remain in marriages that are unhealthy and even border on dysfunctional.",6,Women Relationships and Health,2013-10-14
"As France Prepares for Marriage Equality, Opponents Warn of Civil Strife","The French people strongly endorse same-sex marriage, and support for the right of married gay and lesbian couples to adopt children sits just shy of 50 percent. But the push for equality in France has an ugly underbelly.",6,Women Relationships and Health,2013-04-14
What You Need To Know About Happiness And Depression,"Thanks to the research of Rottenberg and others, however, we are beginning to discover that many of our previous assumptions about depression are dead wrong. Here's what we're learning.",3,Self Help and Education,2015-02-07
"Biden, Putin To Hold Call Over Stepped Up Security Demands",President Joe Biden and Vladimir Putin will speak Thursday as the Russian leader has stepped up his demands for security guarantees in Eastern Europe.,7,International Politics,2021-12-29
"Is The Anna Dello Russo For H&M Hat Practical For Everyday Wear? (VIDEO, POLL)",It takes a special kind of girl to sport a stuffed bird hat.,1,Fashion Lifestyle and Travel,2012-10-22
The Egg Gadgets That Will Make Your Mornings Easier,We all deserve a little ease with our breakfast.,4,Food Home and Lifestyle,2016-09-30
Watchdogs Fear Sequester's Bite: 'We Can't Do The Things We're Here To Do',The federal government's Wall Street watchdogs will feel the pinch of sequestration if Washington lawmakers cannot strike,2,Social Issues and Public Safety,2013-02-23
18 Injured When Hong Kong Escalator Suddenly Reverses At High Speed,Two mechanics have been arrested in connection with the incident.,2,Social Issues and Public Safety,2017-03-27
Trump To Get Outside Help For Potential GOP Convention Battle,"Donald Trump has a Plan B if he's faced with a contested convention, and it involves the sort of outside groups that he's",7,International Politics,2016-05-01
Blended Family Friday: Meet Anessa And Keith's Family,"As part of our Blended Family Friday series, each week we're spotlighting a different stepfamily to learn how they successfully",0,Entertainment and Celebrities,2013-05-03
Meet The New President Of The Berggruen Institute,"Sociologist Craig Calhoun discusses getting into trouble as a kid, talking to strangers and what it means to be American.",7,International Politics,2016-04-29
Kardashian Kurves Contest Launches Sisters' Plus-Size Denim Line,"See Kim's kurvy style through the years: Finally, a Kardashian venture we're (somewhat) excited about. So what does it take",1,Fashion Lifestyle and Travel,2012-07-27
This Episode Of 'SNL' Will Have EVERYTHING,,0,Entertainment and Celebrities,2014-09-17
Obama Administration Offers Desperately Needed Help For People Addicted To Opioids,HHS lays out its plan to raise the patient cap for doctors prescribing addiction medication.,5,US Politics,2016-03-29
"Talking While Making Left Turns Is Distracting, Study Finds","According to government statistics on distracted driving, cell phones are behind 18 percent of U.S. distraction-related deaths",3,Self Help and Education,2013-02-28
The Wildest Celeb Halloween Costumes,"From Heidi Klum's legendary costumes for her annual fete to Roberto Cavalli done up as Karl Lagerfeld, here's proof that big personalities, big costume budgets, and big Halloween parties yield some truly amazing, and amazingly bizarre results.",1,Fashion Lifestyle and Travel,2013-10-08
World Leaders Join Crowd Of Over A Million For National Unity March In Paris,,9,World Events and Society,2015-01-11
As Long as There Is (American) Sitcom,"No matter how TV has changed and will change again over the years, if there is a genre that has no need to reinvent itself, that genre is comedy. The only thing that a good comedy really needs is a small, cozy room full of great and enthusiast writers.",0,Entertainment and Celebrities,2015-04-19
"Toxic Gas Dropped On Syrian Town Where Russian Helicopter Shot Down, Rescuers Say","A spokesman for Syria Civil Defence said 33 people, mostly women and children, were affected by the gas in Saraqeb.",9,World Events and Society,2016-08-02
How Raising An Introvert Made Me A Better Educator,"This article first appeared on QuietRev.com Heidi Kasevich is Quiet Revolution’s Director of Quiet Education, leading the",3,Self Help and Education,2016-04-14
Prince George Doll Is Almost Too Lifelike... (PHOTOS),"However, if porcelain dolls are really your thing, you can get your own delicate Georgie for just $149.99. Will you buy one",1,Fashion Lifestyle and Travel,2013-12-13
"Pfizer, Allergan Scrap $160 Billion Merger Over Tax Loophole Pressure",The announcement followed the unveiling of new U.S. Treasury rules on Monday aimed at curbing such deals.,9,World Events and Society,2016-04-06
Activist Hopes Public Suicide Leads To More Awareness,"ANCHORAGE, Alaska (AP) — An Alaska suicide-prevention activist is hoping a man's very public suicide at an Alaska Native",2,Social Issues and Public Safety,2015-10-20
"Most New Yorkers Aren't Freaking Out About Ebola, So You Shouldn't Either",,9,World Events and Society,2014-10-24
14 Rose Gold Beauty Products That'll Make You Look Like 24 Karats,Get your shine on.,4,Food Home and Lifestyle,2016-08-02
Record $15 Million Gift Will Help Free Innocent People From Prison,The donation to the Ohio Innocence Project is believed to be the largest donation to any program of its kind.,2,Social Issues and Public Safety,2016-09-13
"An Apple a Day ... Takes Your Barbecue to the Next Level! Plus, the Three Best BBQ Sauce Recipes to Try Now",October is National Apple Month. Let's celebrate the contributions this storied fruit has made to American barbecue.,4,Food Home and Lifestyle,2013-10-11
"Top 5 Tastes: Stone Fruit, Seafood and Everything in Between","I consider myself extremely lucky to be able to eat at high class spots, hole in the wall joints, and everywhere in between on a regular basis (and to the immense detriment of my financial funds).",4,Food Home and Lifestyle,2013-08-14
James Clapper Calls Trump's Bin Laden Criticism A 'Slam At The Intelligence Community',The president thinks retired Navy Adm. William McRaven should have brought Osama bin Laden to justice sooner.,7,International Politics,2018-11-20
Donald Trump Says He Fired FBI Director Because He Wasn't 'Doing A Good Job',He weighed in on James Comey's ouster while meeting with Henry Kissinger.,7,International Politics,2017-05-10
Mark Hamill Rips His Role In 'Last Jedi': 'He's Not My Luke Skywalker',The actor dishes on his creative differences with director Rian Johnson.,0,Entertainment and Celebrities,2017-12-22
"Meningitis Outbreak Is 'Nowhere Near The End,' Expert Says",SUSPECT LOTS The FDA said its investigation of that patient and the two who received the heart drug during surgery was ongoing,9,World Events and Society,2012-10-16
Is Your Outdated Career Map Leading You Astray?,"If you have been tending to your career lovingly for many years, you will be able to visit your career map in light of this new discovery, decide what on the map still resonates with you and what doesn't (even massive changes will carry some elements of your ""old life"" into the new), and chart a new course.",3,Self Help and Education,2015-05-09
Holiday Gift Bags vs. Wrapping Paper,Everyone has their holiday pet peeves.,4,Food Home and Lifestyle,2012-12-03
Pour Out A Lil' Liquor For The NFL's Diva Recievers,"Six years ago, the Bengals opened up their season at Paul Brown Stadium against the Ravens. It was also Monday Night Football",0,Entertainment and Celebrities,2013-09-21
11-Year-Old Running Half Marathon to Save the Wolves,"By the time August rolls around he'll start adding some progressively longer runs each weekend to build up his endurance. He's hoping to run like a wolf tracking its prey over long distances: calm, easy, and patient until the end.",9,World Events and Society,2015-04-23
"The Tipsy Hostess' Guide To Moving, If You Absolutely Must (GIFs)","Your martini shaker, for instance, is the last thing you should pack.",4,Food Home and Lifestyle,2013-06-01
Taxes Nightmare For Homesellers Few Understand,"The foreclosure mess due to the economic downturn has left many homeowners facing devastating taxes, even after they sell a house in a foreclosure or short sale or one that is underwater, so they earn little, nothing, or sell the home at a loss.",9,World Events and Society,2013-07-09
Marco Rubio Forced To Say How High He'd Raise Social Security's Retirement Age,The current retirement age for full Social Security benefits is 67 for people born in 1960 and after.,5,US Politics,2016-03-11
"Fearless Girl, Meet Righteous Brother","She’s “standing up to injustice,” in the eyes of New York City’s mayor. Meanwhile, a territorial artist claims that she’s",2,Social Issues and Public Safety,2017-04-17
How to Be Intimate Again After Loss,If the answer is yes: Thank you for taking the first step towards living again. But how could I love again and feel alive,3,Self Help and Education,2013-10-28
The Strange Link Between Eye Color And Alcohol Abuse,"Agata Blaszczak-Boxe, Contributing Writer   |   July 08, 2015 07:44pm ET  People with light-colored eyes may have a higher",2,Social Issues and Public Safety,2015-07-14
"Trolltunga, Norway Is The Scariest Instagram Spot On Earth",Wanna climb (and Instagram) Trolltunga too? Get more info here. Crazy hikers make the four-hour trek to Trolltunga for the,1,Fashion Lifestyle and Travel,2013-11-16
"Nonagenarians Ditch Dating Apps, Go On Blind Date At Bookstore",No Tinder was involved!,6,Women Relationships and Health,2016-04-20
"Parkour Vaults From The Urban Jungle To Soft, Indoor Gyms","""We're not just a gym, we're an educational facility,"" said Ryan Ford, co-owner and instructor at Apex Movement, a Boulder",3,Self Help and Education,2013-10-07
7 Ways to Practice Mindfulness in the Technology Age,"Technology is here to stay.  Why not embrace it and use it to raise our levels of presence?  We can do this by tuning into our breath, our feelings and bodily sensations.  This lets us know how we are relating to technology in the moment.",3,Self Help and Education,2013-01-14
Judge Dismisses Kesha's Abuse Claims Against Dr. Luke,The pop star can continue to litigate her contract dispute with her producer and Sony Music Entertainment.,0,Entertainment and Celebrities,2016-04-07
New Jersey Mountain Home Is Pretty Much Its Own Resort (PHOTOS),"Have something to say? Check out HuffPost Home on Twitter, Facebook, Pinterest, Tumblr and Instagram. ** This single-level",1,Fashion Lifestyle and Travel,2013-07-26
Joseph Gordon Levitt & 'Don Jon's Addiction': Actor's Latest Project Is Raunchy,"Julianne Moore plays the film's most unexpected character, a middle-aged pot-smoking student at the night school Barbara",0,Entertainment and Celebrities,2013-01-19
Fashion Week Live Blog: Everything That's Happening At Day 4 Of NYFW Fall 2014,"Yeah, we know it's Sunday, but more importantly, it's Day 4 of New York Fashion Week. If you're having a hard time keeping",1,Fashion Lifestyle and Travel,2014-02-09
"Bob Woodward's Problems With Hillary Clinton Definitely Aren't Sexist, No Sir",He just wishes she would stop shouting.,7,International Politics,2016-02-03
Hotel Suites Good Enough For The President (PHOTOS),"The commander-in-chief checks in and out of rooms across the globe, but only a few stateside properties have made the White House staff repeat customers -- check out these 13 hotels fit for a president.",1,Fashion Lifestyle and Travel,2012-09-21
"John Corbett, Actor From 'Sex And The City,' Looks Very Different (PHOTOS)","John's blonde hair, soul patch and mustache are quite a far cry from Aidan's low-maintenance vibe. What would Carrie think",0,Entertainment and Celebrities,2013-05-10
Michelle Duggar: 'Each Child Is A Gift From God',"She says their daughter, Jill, gets it completely. ""When you have more people in the family, there is that many more people",8,Family Children and Human Stories,2013-10-11
HUFFPOLLSTER: Weekend Polls Show Hillary Clinton Leading An Increasingly Tight Race,One big question is how much voter enthusiasm will matter.,5,US Politics,2016-09-12
"Packers Block Punt, Ravens Get First Down Out Of It (GIF)","Usually, it's a good thing when a team blocks a punt. But wasn't the case when the Packers blocked a punt from Ravens punter",2,Social Issues and Public Safety,2013-10-13
"Friday Talking Points -- Liar, Liar!","President Donald Trump and former F.B.I. chief James Comey engaged this week in an extended game of ""Liar, liar!"" Or, more",7,International Politics,2017-06-10
"RMS St. Helena, Last of the Storied Royal Mail Ships:  Getting Really, Truly, Terminally Away From It All on the Looney Front (Part 3)","Once they proudly sailed the seven seas, mighty traveling hotels, carrying both passengers and cargo to the furthest outposts of the British Empire, earning their prestigious title of RMS (Royal Mail Ship) by dint of carrying His or Her Britannic Majesty's mail to his or her farthest-flung subjects.",9,World Events and Society,2014-12-15
10 Worst Provisions In The Republican Appropriations Bill,"Last week, Democratic leaders in Congress negotiated with President Trump to ensure that our government stays fully funded",5,US Politics,2017-09-14
The Best Hotel Coffee Bars Across The U.S. (PHOTOS),We've found five of the best hotel coffee bars across the states so you can get that jolt you need without having to leave your hotel.,4,Food Home and Lifestyle,2012-10-29
The Battle of Identities and Presidential Elections in the Arab Region,,7,International Politics,2014-04-18
Chipotle's Paid Sick Leave Has Nothing To Do With Its Food Safety Crisis,"It's still a great move, though.",9,World Events and Society,2016-01-21
"Dylan, Autism and the Butterfly Effect","Is it unreasonable to imagine that a child or children in one part of the world may be helped, simply because one person in another part of the world decided to run a few miles?",8,Family Children and Human Stories,2015-04-06
Funky Freebies And Looney Loaners: The 7 Most Interesting Amenities We've Seen (PHOTOS),"When you're shelling out hard-earned cash for your hotel room, it's nice when the hotel recognizes that and throws in some perks ""just because.""",1,Fashion Lifestyle and Travel,2013-04-04
You Don't Need Rose-Colored Glasses: 5 Realistic Tips to Be More Positive,"I used to look at people like that with a mixture of admiration and annoyance. Then one day I asked myself, what are they doing that is different?",3,Self Help and Education,2015-07-01
"Uber, Waymo Reach Settlement In Bitter Legal Dispute",Uber had been accused of stealing trade secrets from Waymo.,2,Social Issues and Public Safety,2018-02-09
"Scott Pruitt Got 24/7 Security From Day 1 At EPA, New Documents Show",The EPA had justified Pruitt's expensive security as a response to threats. New emails appear to cast further doubt on the claim.,9,World Events and Society,2018-05-15
Romantic Honeymoon Hotels around the World (PHOTOS),Honeymoons must be two things: romantic and memorable. Any old trip to the beach is simply not going to suffice for a couple's post-nuptial getaway.,1,Fashion Lifestyle and Travel,2013-03-24
An Honest Customs Declaration Form,"Whether you're traveling with immediate family members or not, you'd better fill out at least three or four extra copies",8,Family Children and Human Stories,2012-06-20
Easter Cheese Crescia,"I collected this recipe from scraps found in my grandma's old notebook, which had been buried in a closet for several years.",4,Food Home and Lifestyle,2014-04-18
5 Boutique Hotels With Sex Appeal (PHOTOS),We picked our favorite boutiques that have all the necessary trappings for romance.,1,Fashion Lifestyle and Travel,2013-02-27
One Formula to Lead and Live Better: 75+/25-,"We've all heard about the ""power of positive thinking,"" but flick on the news, and you'll see the world seems to prefer tuning in to the negative most of the time.  Where's the good stuff? The answer: It's everywhere.  It's free of charge, too.",3,Self Help and Education,2014-09-18
Chris Hayes Demands Donald Trump Resign With Damning Review Of His Presidency,"It is “an urgent matter of public health” that Trump quits, the MSNBC host said.",7,International Politics,2020-06-27
"Naked Drunk Driver Crashes Car While Having Sex At The Wheel, Police Say","An infant was in the vehicle's backseat at the time, according to authorities.",2,Social Issues and Public Safety,2017-11-25
Vaccine of Hope,"""We have developed a vaccine to prevent breast cancer!""  No, you're not seeing things. These were the exact words expressed by Dr. Vincent Tuohy, immunologist at the Cleveland Clinic, who announced the development of his breakthrough breast cancer vaccine earlier this month.",9,World Events and Society,2013-04-30
Patricia Smith Sentenced To 78 Months After Embezzling More Than $10 Million,"Steven Balmer, in a report for Traveler's Insurance, explains, ""Employees may be motivated by events going on in their own",2,Social Issues and Public Safety,2012-06-21
Dustin Lance Black Has Great Reply After Being Told Two Men Shouldn't Raise Kids,"The Oscar winner stayed calm, cool and collected.",0,Entertainment and Celebrities,2018-04-02
Noah Syndergaard Just Sent A Trump-Bashing Tweet About Hurricanes,"""Stick to baseball,"" one commenter sniped.",7,International Politics,2017-09-19
Cadbury Eggs vs. Peeps: Which Is Better? (POLL),"This is not so much a question of which came first, but more so of which is better -- the chick(en) or the egg? We're not",4,Food Home and Lifestyle,2012-04-06
Floyd Mayweather Jr.'s Girlfriend: Miss Shantel Jackson Wears Revealing Dress To Fight (VIDEO),"WATCH VIDEO ABOVE Of course, it is a previous flame of Floyd's that will have him back in the headlines in a few weeks. Mayweather",0,Entertainment and Celebrities,2012-05-06
Festive Foods: What The World Eats At The Holidays,"Celebration is in the air around the world as the year comes to an end. And with every family gathering, religious ritual",4,Food Home and Lifestyle,2012-12-18
Saudi Crapshoot in Yemen,"While all eyes are on Syria and Iraq, another intervention is taking place in Yemen. The coalition involved here is more of an understanding than a military pact, but it is proving to be just as effective.",9,World Events and Society,2014-09-28
'Say Yes To The Dress' Is Addictive Even Though I Am Already Married,"This summer, I have spent more hours than I care to count watching Say Yes to the Dress""  even though I am not getting married,and if I were, the likelihood of me spending several thousand dollars on a dress is pretty nil. So, I feel as if I am a surprising audience for this TV show that centers around extravagant wedding gowns.",1,Fashion Lifestyle and Travel,2012-07-23
"9 Cheeses We Would Happily Marry, If That Was Allowed","In sickness, and in health, for the rest of our lives.",4,Food Home and Lifestyle,2013-10-10
Paula Deen: Weight Loss Was A Family Affair,"Together, the four have lost 178 pounds total. Deen's husband, Michael Groover, is down 60 pounds, according to People, while",0,Entertainment and Celebrities,2013-01-24
"Big Pharma Says It Offers Cheap Vaccines For Refugees, But It’s Not Completely True",Doctors Without Borders is petitioning Pfizer and GlaxoSmithKline to lower the prices on the shots.,9,World Events and Society,2016-08-05
'Milk In My Sippy Cup': Pint-Sized Kid Stars In Adorable Rap Video,"A little boy in a striped shirt, a blue hat, and loose-fitting pants potters around his yard, playing with a yellow ball",8,Family Children and Human Stories,2012-06-19
Recordings Released From The Day Michael Brown Was Shot,,2,Social Issues and Public Safety,2014-11-15
"Customer Gives Mega Tip So Single Dad Can Get Dental Work, Reason To Smile",,8,Family Children and Human Stories,2015-03-10
Ex-Sheriff David Clarke Faces Trial Over Facebook Taunts Against Plane Passenger,"A federal judge said Clarke's posts were an issue of possible ""First Amendment retaliation.""",2,Social Issues and Public Safety,2018-01-07
"New Poll Shows Donald Trump, Jeb Bush In Dead Heat",,7,International Politics,2015-07-11
Getting 'The Bird' From a Bird,"Filming with animals can be a lot more complicated than filming with people and it takes a lot more preparation than one might think.  One wants it to go well, so one can never be prepared enough.",0,Entertainment and Celebrities,2015-03-03
Bill Would Turn Veteran Bars Into Wellness Centers,"""When you look at some of the struggles our veterans are dealing with, the suicide rates, it just is common sense,"" says Rep. Glenn Thompson (R-Pa.).",5,US Politics,2015-11-10
HuffPost Rise: What You Need To Know On June 9,"Welcome to the HuffPost Rise Morning Newsbrief, a short wrap-up of the news to help you start your day.",5,US Politics,2016-06-09
"Trump's Legacy: 2 Impeachments, An Insurrection, Countless Lies And Corruption","Donald Trump called everything he did, from his election to his trade deals, ""historic."" But his last months in office finally make that claim correct.",7,International Politics,2021-01-17
This Sad Version Of The Toys R Us Jingle Will Hit You Where It Hurts,Sniff.,0,Entertainment and Celebrities,2018-03-16
"The Past, Neat or On The Rocks: Glenfiddich Recreates a Seminal Single Malt",,4,Food Home and Lifestyle,2014-12-30
Federal Requests For Patient Info Raise Red Flags In States That Allow Medical Pot Use,"""With the anti-marijuana rhetoric coming from the Trump administration’s Department of Justice, you do have to wonder what the true motivation is here.”",2,Social Issues and Public Safety,2017-09-12
Prep School Sexual Assault Convict Owen Labrie Sent To Prison,The case exposed a tradition of sexual abuse at the prestigious school.,2,Social Issues and Public Safety,2016-03-19
"Bombs Kill At least 12, Wound Dozens At Pakistan Court",The attacks occurred hours after militants killed two people in a Christian neighborhood in the same region.,2,Social Issues and Public Safety,2016-09-03
