headline,short_description,cluster,event_label,date
Hangman,,0,Entertainment and Celebrities,2016-03-19
Sunday Roundup,"This week, as Joe Biden inched closer to jumping into the presidential race, Ben Carson inched closer to forcing us to retire the use of ""brain surgeon"" as a linguistic stand-in for ""brilliant genius,"" with thunderingly dumb comments about guns, the Umpqua Community College shooting, and the Holocaust. Meanwhile, Congressional Republicans took on the trappings of a badly written soap opera, with Kevin McCarthy abruptly withdrawing from contention as the next Speaker due to opposition from Tea Partiers who didn't find him conservative enough -- or was it really because of those rumors of a steamy extramarital affair with a colleague? Tune in next time for ""As the GOP Turns""... Is it any surprise that neither John Boehner nor Paul Ryan wants a position that has gone from someone who can get things done to someone who promises to stop all things from getting done? Welcome to today's Washington.",5,US Politics,2015-10-11
This Pastor Self-Immolated To Protest Social Injustice,,2,Social Issues and Public Safety,2014-07-15
Is 'Trump Fatigue' Real? How Reader Engagement Has Fared In The Post-Election Era,"News readers aren't losing interest in politics, but Trump isn't everything, either.",7,International Politics,2018-01-26
Nearly 60% Of Countries At Risk Of Using Slaves In Supply Chains: Report,"The issue has received increasing attention in recent years with exposes in sectors as diverse as fishing, mining and textiles.",9,World Events and Society,2016-08-11
When the Man You Love Asks You to Lose Weight,"I yelled at him and told him he did not love me. Love would not notice the 300 pounds my 5'3"" frame carried. Confused, he just stared at me; he knew more than anyone how desperately I wanted and needed to lose weight. He alone knew all my secrets. He heard my disappointments. He hoped for my future.",6,Women Relationships and Health,2013-11-14
Unique Marriage Proposals: The Most Unconventional Products Used To Pop The Question,He's not the only one to use an unexpected item -- like a onesie -- to propose. Men have taken inspiration from coffee cups,4,Food Home and Lifestyle,2013-03-14
"Joe Arpaio Is Still Guilty Despite Presidential Pardon, Judge Says",The former sheriff's request to wipe out his criminal conviction was denied.,2,Social Issues and Public Safety,2017-10-20
Taylor Swift Is Still Dancing To That Iggy Azalea Song,,0,Entertainment and Celebrities,2014-10-31
5 Things I Learned at Summer Camp,"Summer camp was one of the best, most formative experiences of my life. At least, in hindsight it was. At the time it was",3,Self Help and Education,2012-05-18
How to Prevent Child Identity Theft Part One: How Parents Can Help,"To reduce the number of child identity theft cases, it's important for parents to get in the know. Here are a few tips for parents to help prevent child identity theft from occurring.",8,Family Children and Human Stories,2013-08-30
There's Nothing Like Stunning Nature Photos To Remind You Of How Little You Are,Andrew Studer's photos are the most beautiful reality check.,1,Fashion Lifestyle and Travel,2016-10-06
"Rudy Giuliani Accuses Obama, Black Leaders Of Stoking 'Anti-Police Hatred'",,7,International Politics,2014-12-21
"Lizards Hatch From Their Eggs Prematurely To Escape Danger, Study Suggests (VIDEO)","There may be a downside to such emergency exits, however. ""[E]arly hatching skinks were significantly smaller and left behind",9,World Events and Society,2013-04-06
Beating the Cancer Blues,"Sometimes, cancer would stroll next to me, repeatedly kicking me, punching me, making me fall.I fell down a lot. Sometimes it was more like tripping over my feet. Sometimes I didn't know how to get up. Everyone I know who has gone through cancer has felt this.",3,Self Help and Education,2013-02-21
Photo Series Captures The Endearing Misery Of Dogs At Bath Time,,1,Fashion Lifestyle and Travel,2014-05-16
180 Kilometers of Motivation,"Each stage of this hike, and each stage of anything big in our lives, has its own unique terrain and demands real effort. In the high alpine and the luscious valleys, I learned to appreciate this reality.",3,Self Help and Education,2012-10-18
'Price Is Right' Model Breaks The Set In Hilarious Fail,Eh ... not quite model behavior.,9,World Events and Society,2015-10-24
"After Deadly Disputes, Policing Can Never Be the Same",If you don't realize that a new day has dawned in law enforcement -- a day where a growing number of citizens automatically mistrust cops -- you might want to get back out on the street and walk a beat for a day or two.,2,Social Issues and Public Safety,2014-12-21
Philando Castile's Girlfriend Breaks Down In New Facebook Video,"""He was crying, they took my phone and threw it. They had machine guns pointed at my back.”",2,Social Issues and Public Safety,2016-07-07
Queer New World: Meet Brooklyn's Crimson Kitty,"Drag King K.James described you as a ""female-to-female or FtF drag queen."" As a cisgender woman, what would you say to those",6,Women Relationships and Health,2014-01-18
Fancy Food Box Subscription Is Like Gourmet Personal Shopper,"Maybe you love handmade cookies and locally-grown teas, but you just don't have the time.",4,Food Home and Lifestyle,2013-03-01
Canada’s Next Big Thing - The City Of Mississauga,"The 700,000+ population strong city of Mississauga is poised to be the next big Apple of Canada. With the latest developments",9,World Events and Society,2017-05-04
"Cruising Alaska: Kayaking, Paddleboarding and Bear Fishing","Whether on a small-boat tour, or even closer to the water in a kayak, when exploring desolate little bays and inlets, sea lions are a constant presence.",9,World Events and Society,2012-12-19
Criminal Justice System Disenfranchises Former Convicts Looking For Work,,2,Social Issues and Public Safety,2015-03-01
"iPad Mini Event And Mockups, New Retina MacBook In Tow: This Week In Apple Rumors","Hello, ladies and gentlemen, and welcome to This Week In Apple Rumors, our regular look back at all of the week's unconfirmed",9,World Events and Society,2012-10-14
Tina Fey Has A Confession About Those '30 Rock’ Reboot Rumors,"""A little bit of that is on me.""",0,Entertainment and Celebrities,2018-04-20
Children Harvest Crops and Sacrifice Dreams In Mexico's Fields,,8,Family Children and Human Stories,2014-12-14
Here's What Everyone Gets Wrong About Social Anxiety,This is not about being shy.,3,Self Help and Education,2018-04-10
Stephen Colbert Tosses Donald Trump Upside Down Into 'Stranger Things',"""Seriously?""",7,International Politics,2017-10-27
Hurricane Sandy Victims Face Credit Uncertainty Due To Banks' Opaque Policies,"""We have been thrown into a pit of financial uncertainty,"" Sposato, who is the comptroller for a national theater group, said",9,World Events and Society,2012-11-14
Holding The Sun Photos Have Us Longing For The Outdoors,"this, We'd all like to do it. Hold on to the last slivers of summer before we hang up our bikinis and swim trunks for our",1,Fashion Lifestyle and Travel,2013-09-21
5 Weight Loss Habits That Are Making You Gain Weight,"I've been around the dieting block a couple of times myself. OK, more than a couple. Right now, I'm in that unenviable spot of having no clothes that fit comfortably while I'm in a stare-down contest with summer. Who's going to blink first: My need to lose my winter poundage or that bathing suit I won't wear unless I do?",4,Food Home and Lifestyle,2014-06-05
HUFFPOLLSTER: Who Represents The Future In 2016?,,5,US Politics,2015-02-19
House Passes Tax Extenders Legislation Despite Democratic Objections,The bill could add $600 billion to the national debt over the next 10 years.,5,US Politics,2015-12-17
Utah Shakespeare Festival Offers Unique Experience,"The Utah Shakespeare Festival is truly unique. Founded in 1961 and presenting its first season in 1962, the organizers wanted to create something special. And they have.",0,Entertainment and Celebrities,2014-08-17
Blake Lively And Ryan Reynolds Serve Up Hollywood Glamour At The Golden Globes,Stunning.,0,Entertainment and Celebrities,2017-01-09
Le Kale Project: A Mission to Bring Kale to Paris,"At farmers' markets and shops and restaurants, kale was as absent as a rude waiter.",4,Food Home and Lifestyle,2014-02-27
Amazon To Sell Smart Locks So It Can Slip Packages Into Your Home,The move signals Amazon’s ambitions in the growing market for home security devices.,9,World Events and Society,2017-10-25
"For Men, It's More Waist Management Than Weight Management","Time to stop blaming the wife or family, and start eating like a man. That doesn't mean starving yourself, or eating like a bird. It means managing your nutrition, and tackling your stress as well. Here's what men can do to take control of their waists, and their health.",6,Women Relationships and Health,2012-07-26
The Essential Tools Every Renter Should Own,"Basic tools come in handy for the entire lifecycle of your rental, from the day you move in and set up your new space, to the moment your last box is packed and ready for move out. Plus, these essentials won't take up much space and can be purchased at a low cost.",9,World Events and Society,2013-09-30
The Best Bargain Booze,When you're planning a party -- it could be a housewarming or a frat party (don't worry we won't judge!) -- that requires,4,Food Home and Lifestyle,2012-04-13
WATCH: Volcanic Eruption Sends Shockwave You Have To See To Believe,,9,World Events and Society,2014-09-10
"Aperture's 'Photography' Exhibition Combines Big Names, Punchy Colors And Fujifilm X-Series Cameras (PHOTOS)","William Eggleston is the classic American veteran, Nan Goldin the grimy provocateur and Martin Parr the extra-saturated satirist",1,Fashion Lifestyle and Travel,2013-02-03
Taliban Making Military Gains In Afghanistan,,9,World Events and Society,2014-07-26
4 Powerful Reasons to Eat Grapefruit,"Citrus season is here and while oranges and clementines definitely pack a health punch, it's time to make some room for grapefruit.",4,Food Home and Lifestyle,2012-03-09
Watch A Hawaiian Volcano 'Smile' For The Camera,"Meet Kilauea, the world's happiest volcano. 😃",1,Fashion Lifestyle and Travel,2016-07-30
"Donald Trump Ramps Up Attacks On Jeff Sessions, DOJ As Firing Rumors Spread","Last week, the president sharply criticized Sessions' decision to recuse himself from the FBI's Russia investigation.",7,International Politics,2017-07-25
Public Speaking: Expert Advice To Help You Fight The Fear,Brian: Empathy comes from the listening aspect of public speaking. The prisoners who participated realized that people have,3,Self Help and Education,2012-09-19
James Corden Calls Out Donald Trump's Travel Ban,Simple yet powerful.,7,International Politics,2017-01-31
Tackling A Problem? Why You Really Should 'Sleep On It',Sleep > everything else.,3,Self Help and Education,2016-02-23
"Kate Middleton Handmakes Christmas Cards, According To Sister, Pippa",Just another reason why we love her...,1,Fashion Lifestyle and Travel,2012-12-23
Changing How We Share Sustainability Ideas,,3,Self Help and Education,2014-07-20
Emma Watson Reportedly Dating 'Glee' Star Chord Overstreet,They were spotted holding hands and looking very much like a couple.,0,Entertainment and Celebrities,2018-03-12
"Most Americans Use Outdoor Spaces For Relaxation, According To PLANET Survey (PHOTOS)","When the warm days of May roll around (soon we hope!), dining al fresco, gardening and reading in the backyard or on on the",3,Self Help and Education,2013-05-08
Brain Injury Rate 7 Times Greater Among U.S. Prisoners,"One of the big challenges in addressing TBI in prison populations, and beyond, is that it is not as easy to diagnose as a",2,Social Issues and Public Safety,2012-02-06
Switching Schools Frequently Linked With Mental Health Problems In Kids (STUDY),The findings were published online Feb. 14 in the Journal of the American Academy of Child & Adolescent Psychiatry. The results,8,Family Children and Human Stories,2014-02-25
Celebrating Malcolm X's 90th Birthday Through Collective Courage and Not Mere Nostalgia,"Understanding the living legacy of Malcolm X - and joining causes together as one unified front - allows us to focus on the successes and challenges of ongoing struggles, rather than lamenting a lost era.",3,Self Help and Education,2015-05-19
This Is How High School Made You A Better Person,Adults have always bemoaned the moral decay of the younger generation. And they keep getting it wrong.,6,Women Relationships and Health,2015-06-28
"Thanks, Birth Control","I make my big declarations of gratitude at Thanksgiving dinner, and my list doesn't vary much from year to year. This year though, I'm changing things up. This year, not only am I making my list public, I'm also adding something new.",4,Food Home and Lifestyle,2013-11-12
Chris Cuomo Reveals ‘Ugly’ Reason Why Donald Trump Downplays Coronavirus Testing,"“It is dishonest and destructive and it is done by design.""",7,International Politics,2020-05-07
"From Hunger to Climate Change: Transform Words into Action, Says Pope Francis",The challenges the world faces today are sometimes so big and so many that they can scare us into inaction or nudge us into looking only at our immediate surroundings or our immediate needs. We need to resist the temptation to do both.,3,Self Help and Education,2015-06-17
Friday's Morning Email: Inside The Chaos After Brexit Vote,David Cameron resigns as the markets plummet.,9,World Events and Society,2016-06-24
Clinton Voters Being Proven Depressingly Right,Most of the bad things you thought would happen have basically happened,5,US Politics,2017-05-16
Low on Dough This Holiday Season?,"Black Friday and Cyber Monday are stark reminders that Christmas has become the most wonderful time of the year... for retail. When the main focus of the holiday is on, 'What did you get?' we miss out on the true spirit of the holiday season.",4,Food Home and Lifestyle,2013-12-19
Ben Carson Once Did Research On 17-Week Aborted Fetal Tissue,He has since slammed Planned Parenthood over its link to the same research.,7,International Politics,2015-08-13
What's the Situation With Your Work... 'Situation'?,"While I'm telling you to be honest with yourself, I'm not advising you to go into work tomorrow and leave a dead fish on your boss' desk with a note that reads ""I quit, jerk!"" It's not always easy to find another job, so your first plan of action should be to try and mend your current job ""situation.""",3,Self Help and Education,2014-02-05
Jennifer Lawrence Is In A Full-Blown Feud With A Reality TV Star,"Lala Kent of ""Vanderpump Rules"" didn't take too kindly to the actress' criticism.",0,Entertainment and Celebrities,2018-03-07
Memorial Day Road Trip Travel Etiquette,"If you are tired, let someone else do some driving. Respect your exhaustion. Never risk the safety of yourselves and those around you to try to get to your vacation spot a little earlier. It's just not worth the risk.",3,Self Help and Education,2014-05-19
Syria Ceasefire Agreement Reached By World Powers,The agreement is a step in the right direction after numerous failed attempts to address the nightmarish war in Syria.,9,World Events and Society,2016-02-12
12 Father's Day Lessons About Live Fire Cooking by Steve Raichlen,"In many families, grilling and barbecue are rites of passage.",4,Food Home and Lifestyle,2013-06-11
Tears For Zakir Khan,"I reached out to Khan when I was poor. However, he did not reach out to me when he became poor. In fact, I have received",3,Self Help and Education,2017-02-25
HuffPost Workouts: Valentine's Day Music To Help You Workout,"We made you a playlist -- and, yes, it includes Beyonce and Jay-Z.",0,Entertainment and Celebrities,2013-02-13
Church Shooting Leaves 5 Dead In Russian Region Of Dagestan: Report,The attack occurred in the village of Kizlyar in the Muslim-majority republic of Dagestan.,2,Social Issues and Public Safety,2018-02-18
Val Kilmer Spotted Without Breathing Device Around His Neck In London,"Looking good, Val!",0,Entertainment and Celebrities,2016-02-16
Rachel Leyco Bridges The Diversity Gap In Her Latest Short Film,The fight for more diversity in media is a battle that’s been given a lot of attention this year. Thanks to shows and films,0,Entertainment and Celebrities,2017-08-02
Why Female Comedians Have A Secret World Of Facebook Groups,"To deal with everything from harassment and sexism to career advice, female comics have found a solution through private forums on Facebook.",6,Women Relationships and Health,2016-08-31
Lack Of Diversity In Tech Makes It Difficult To Override Russian Fake News,"The outrage over Russian manipulation of social media platforms like Facebook, Google and Twitter during the 2016 election",7,International Politics,2017-11-14
Honoring Rev. Dr.  Luther King Jr. - Remembering the Prophetic in the Prophet,"During a time of great concern and unrest in our communities, country, and world, celebrating Rev. King's birthday brings me joy and hope. The fact that his birthday is a nationally recognized holiday makes me both proud and optimistic.",3,Self Help and Education,2016-01-16
Here’s The Feminist Symbol You Missed In Beyoncé’s Performance,"Yes, that's a Venus symbol.",1,Fashion Lifestyle and Travel,2016-08-29
How I Went From A Single Gal To A 'Wif' (75 Percent Of A Wife) To A Wife,The first few years of our marriage I REFUSED to be a called a wife. A wife was a secondary complement to the man. A wife had no other identity. I mean what happened to my name... now I am just wife. I don't think so.,6,Women Relationships and Health,2012-06-04
Both Trump And Obama Moved Quickly To Save Indiana Jobs. One Has Sold It Better.,"The public relations element of the presidency matters, as Donald Trump is showing.",7,International Politics,2016-12-01
Amish at the Cutting Edge of Genetic Technology,Two groups of people that shy away from many technologies -- Amish and Mennonites -- are actually on the cutting edge when it comes to genetics.,9,World Events and Society,2013-10-03
‘The View’ Co-Hosts Smack Down Howard Schultz’s Presidential Ambitions To His Face,"“Your entry into this race will guarantee Trump another four years,” Joy Behar told the former Starbucks CEO.",7,International Politics,2019-01-29
DIY Mother's Day Gifts: Turn A Notebook Into A Journal With This Trick,"For the full tutorial, head over to HomeLife or pick up a copy of ""The Homemade Home"". Have something to say? Be sure to",8,Family Children and Human Stories,2012-05-12
"Lady Gaga And Joseph Gordon-Levitt Breeze Through 'Baby, It's Cold Outside' Together (VIDEO)","video platformvideo managementvideo solutionsvideo player Joseph Gordon-Levitt has gone and charmed us again, this time taking",0,Entertainment and Celebrities,2013-11-30
"Philadelphia Man Shot And Killed His Wife With Crossbow, Police Say","The 41-year-old man will face charges for killing Pamela Nightlinger, 42.",2,Social Issues and Public Safety,2016-06-27
A Second Even More Unjustifiable Episode of Government Collection of Phone Records,"In the rush to sensationalize the Paris terrorist attacks and minimize all other news (for example, even more horrendous terrorist attacks in Nigeria), the American media has conveniently overlooked one major ill effect of the public hysteria it is helping to foment.",7,International Politics,2015-01-19
Why I Had To Talk To My Kids About Sex Offenders,"I have always been fairly frank with my kids. I started the difficult conversations about things like sex, sexuality, drugs",8,Family Children and Human Stories,2013-03-22
How to Get the Best Personal Branding Image,"During my time as a personal branding photographer I have seen some interesting corporate images. I have seen photos that have been taken in a bar, on street corners, in living rooms. Many are fuzzy, low res, grainy and too dark or too light.",1,Fashion Lifestyle and Travel,2014-11-11
Will The New Horizons Mission Give Pluto A Second Chance At Planethood?,"Is Pluto a planet?  It's a simple question, but one scientists and space buffs have been debating for years. Back in 2006",9,World Events and Society,2015-07-15
Alleged Pizza Roll Pooper Apprehended After Oklahoma Grocery Store Incident,"“I grabbed the bag, I felt something smushy on the bag, so I turned it over and there it was,” lamented shopper Shirley Wright-Johnson.",2,Social Issues and Public Safety,2021-09-16
What TSA's New Scanner Rules Mean For Your Next Flight,The Transportation Security Administration's new rules for screening passengers with its controversial full-body scanners -- which were quietly changed just before the busy holiday travel season -- represent a significant policy reversal that could affect your next flight.,9,World Events and Society,2016-01-03
Banding Together to Ban Trophy Hunting and Protect African Lion Livelihood,"Needless killing of endangered species for trophies is inherently unsustainable, economically short-sighted, ecologically unsound, and morally wrong. The sooner it ends for lions and other imperiled animals, the better.",9,World Events and Society,2013-01-26
There Is No Denying Life,The only way we learn is by making mistakes -- there is no shame in that. The only way we grow is by accepting them --  there is only insight in that. The only way we evolve is by letting them go -- there is only beauty in the enlightenment that follows.,3,Self Help and Education,2013-10-24
Canned vs. Bottled Beer: Can You Really Taste The Difference?,"When it comes to beer, the container it comes in holds a lot of sway -- the debate between cans vs. bottles is an ongoing",4,Food Home and Lifestyle,2012-06-07
The Unwanted Guest,"I have been blessed with this ESP. I gladly concede to this clairvoyant gift so long as my husband remains untouched -- but that is impossible. The demon is sewn to my husband's soul. We can lock him up, but he will never leave us.",3,Self Help and Education,2014-12-06
"When Fire Met Food, The Brains Of Early Humans Grew Bigger","If it weren't for making a meal, we wouldn't be where we are today.",4,Food Home and Lifestyle,2012-10-25
7 Tools For Parenting With Purpose,Regain control of your family and bring peace to your household with these seven tools.,8,Family Children and Human Stories,2014-08-22
Yoga To Turn A Bad Day Around,By Heidi Kristoffer for Shape.com Have you ever felt like you woke up on the wrong side of the bed and that was the best,3,Self Help and Education,2014-03-18
Mitch McConnell: ‘Classless’ Obama ‘Should’ve Kept His Mouth Shut’ About Trump,The Senate majority leader wants the former president to keep quiet.,5,US Politics,2020-05-12
AT&T Agrees To Buy Time Warner,The colossal merger could reshape the media ecosystem -- if regulators let it happen.,9,World Events and Society,2016-10-22
The 'Some Days' When You're a Special Needs Family,Will the boys resent the time and energy their sister required? What will they have to deal with when my husband and I are no longer here? Who will take care of Lizzy when we can't do it ourselves?,8,Family Children and Human Stories,2015-06-02
Protesters Unfurl 'Racism Is As American As Baseball' Sign At Boston Red Sox Game,Security guards confiscated the sign within a matter of minutes.,2,Social Issues and Public Safety,2017-09-14
"Fire At Planned Parenthood Was Started By Arsonist, Authorities Say","""The toxic rhetoric directed at Planned Parenthood has dangerous consequences.""",2,Social Issues and Public Safety,2015-10-02
This Beauty Vlogger Empowers Afro-Latinas To Embrace Their Blackness,"“I was always this girl who felt like she had to choose between being black or Dominican,"" vlogger MonicaStyle Muse told HuffPost.",1,Fashion Lifestyle and Travel,2018-02-28
The 2017 VMAs Red Carpet Was As Outrageous As Ever,"Check out all the looks from the red (er, blue) carpet.",1,Fashion Lifestyle and Travel,2017-08-27
Cory Gardner Midterm Election Results: GOP Challenger Defeats Incumbent Mark Udall,,5,US Politics,2014-11-05
The Joy of Being Wrong When a Subordinate Disagrees With You,,6,Women Relationships and Health,2016-12-28
Greyhound Doesn't Know If Its Own Bus Drivers Are Too Tired,A CNN investigation found more  drivers who may be fighting fatigue.,2,Social Issues and Public Safety,2016-05-25
Bill Gates On Whether He's The Happiest Man On The Planet,"""Now I do it a couple days at a time,"" Gates said. Watch Gates' interview above and see more from Davos below: Gates also",0,Entertainment and Celebrities,2014-01-25
We Need to Talk About Domestic Terrorism,"It's time for us to stop being polite and keeping the peace in our families, to stop hiding behind sympathetic posts on social media and instead have hard discussions about where we, as families, are at. To tell those close to us how afraid we are that, some day, we might see their mugshot on television after a horrific event.",2,Social Issues and Public Safety,2015-11-29
Cosby Accuser Lili Bernard Leaves Courtroom In Tears After He's Found Guilty,"""It is a victory for all sexual assault survivors, female and male,"" Bernard said of the verdict in Bill Cosby's trial.",2,Social Issues and Public Safety,2018-04-26
Did A Study Find Your Cat Hated Having You Home During Lockdown? Not Quite.,A survey found cat owners tended to be split on whether their felines loved or hated having people around so much.,6,Women Relationships and Health,2021-07-10
Republican Tillis Wins North Carolina Senate Primary,,5,US Politics,2014-05-07
"How A (Very) Little, Daily Favor Can Change Your Life","Even if you don't get a favor in return, you'll reap some big benefits. Giving has strong ties to longevity and happiness",3,Self Help and Education,2013-09-03
