headline,short_description,cluster,event_label,date
New ‘Incredibles 2’ Trailer Is All About Mom’s New Job And Dad Staying At Home,Get a sneak peek at Bob Odenkirk’s new character as well.,0,Entertainment and Celebrities,2018-04-13
Why Is Everyone Suddenly Running? Because TRUMP'S COMING!,Everyone flee!,7,International Politics,2016-11-18
Cambridge Analytica Founder Once Compared Trump To Hitler,"Trump vilified Muslims the same way Hitler vilified Jews, Nigel Oakes said.",7,International Politics,2018-04-17
How Salt Water Really Affects Your Hair & What To Do About It,"Here at HuffPost Style, we are passionate about protecting our skin from the sun. Laying out on the beach for hours may feel",3,Self Help and Education,2013-08-02
Gay Talese Says Kevin Spacey Accusers Should Just 'Suck It Up',Whole lotta no.,0,Entertainment and Celebrities,2017-11-08
The Content Brief: What's Up With All the Hacking?,"Facebook, Apple and Twitter were all targeted recently as well, possibly by the same Eastern European gang. You can check",2,Social Issues and Public Safety,2013-02-23
Carpool Playlist: Songs For Superheroes,Your caped crusader goes after bad guys and leaps Lego buildings in a single bound. Put ka-pow! in playtime with a superhero,0,Entertainment and Celebrities,2013-01-11
Russia May Crack Down On Duty-Free Alcohol Thanks To In-Flight Brawls,"""Changes are needed to end such uproar on planes. It's a direct threat to flight security,"" he said, without giving any other",9,World Events and Society,2013-02-04
Dave Brat Hires Same GOP Firm Doing Immigration Work For Mark Zuckerberg,,5,US Politics,2014-07-18
"Yes, Microlending Reduces Extreme Poverty","Overall, however, my study suggests that more microcredit would benefit poor countries. National governments and international",9,World Events and Society,2017-06-27
Trader Joe's Seafood Promise to Greenpeace Still Murky,"Although Trader Joe's is moving in the right direction, I can't go there today and pick up fish fillets for dinner without worrying about whether I am contributing to the degradation of the ocean.",4,Food Home and Lifestyle,2013-05-13
Computer Science in K-12 Classrooms Needs to Catch Up,It's estimated that in the next decade the number of computer science jobs in the U.S. will outnumber qualified people by 1 million. That's 1 million jobs for the taking that Americans will miss out on because of inadequate skill sets.,9,World Events and Society,2014-08-03
What Is it Like to Take a Cross-Country Road Trip by Bike?,"And reader, if you haven't learned the taste of that kind of love yet, I hope you do. I thought of giving up. There was no",3,Self Help and Education,2012-05-29
Trump's Biggest Wins On Tuesday Were These Obscure Races In Pennsylvania,Has the Trump campaign finally figured out how the nominating process works?,5,US Politics,2016-04-27
Bernie Sanders And Hillary Clinton Are Actually Fighting About Barack Obama,It's a debate over what Obama accomplished -- and what he didn't.,5,US Politics,2016-01-28
"Rock, Paper, Scissors: A Dialogue on Who We Are","This is a genuine inquiry into the nature of life, desire, suffering and happiness. I hope you will enjoy taking this philosophical journey with the three most neurotic, supposedly non-sentient beings in the universe.",3,Self Help and Education,2012-02-29
Pinners To Follow: Chronicle Books And 4 Other Pinterest Accounts,These accounts are hot!,1,Fashion Lifestyle and Travel,2012-11-21
Going Back To The Old Whooping Cough Vaccine Could Save Lives,The current pertussis vaccine isn't as effective as the old shots.,9,World Events and Society,2016-03-30
Throwback Thursday: How a DNA Test Broke an Immigration Officer's Heart,"Covered in torture scars, Alonzo fled to the United States, leaving five children behind. After winning political asylum, Alonzo filed visa petitions for his children to join him. The children's fates thus landed in my very inexperienced hands.",2,Social Issues and Public Safety,2014-09-25
Popular Sumatran Tiger Melati Killed By Intended Mate At London Zoo,"Melati, 10, was fatally mauled when she was introduced to Asim.",2,Social Issues and Public Safety,2019-02-09
"This Father's Day, Give the Gift of Gin","Fatherhood is one great big adventure, so why not get a little adventurous on his day? Here are 11 off-the-beaten path gins for Father's Day.",8,Family Children and Human Stories,2013-06-13
"Soap Opera Hair: Julianne Moore, Kelly Ripa And More Celebrities Before They Were Famous (PHOTOS)","Did you know that before Julianne Moore starred in films such as, ""Crazy Stupid Love"" and ""The Kids Are Alright,"" she played",0,Entertainment and Celebrities,2012-05-23
Service Workers To Rally Against Trump Immigration Policies,"The hospitality union Unite Here plans demonstrations in 40 cities: ""We need protections for the workers who drive this industry.""",2,Social Issues and Public Safety,2017-10-14
Taylor Swift Predicted This Kim Kardashian Recording Disaster Last Year,🔮 POP STAR PRECOG. 🔮,0,Entertainment and Celebrities,2016-07-20
Did Boston Children’s Hospital Plan An Exorcism?,What Three Children’s Hospital Psychiatrists Were Up To A Year Before The Pelletier Case Might Surprise You This article,2,Social Issues and Public Safety,2017-04-17
The World's Largest Renewable Energy Developer Could Go Broke,"Blame the ""hyper-growth"" strategy.",9,World Events and Society,2016-03-29
Betsy DeVos Kicks Off Her New Job By Making A Joke About That Famous Bear Comment,The new education secretary has faced unprecedented opposition.,7,International Politics,2017-02-08
For Dad,My dad (Frank Hawk) died of lung cancer in 1995. He was my biggest fan. He supported me when I chose skateboarding over all other sports.,8,Family Children and Human Stories,2013-06-14
Jimmy Fallon And Kristen Stewart Crack Up Playing 'Word Blurt',"""Marshmallow belly.""",0,Entertainment and Celebrities,2015-08-12
My Candidates Lost: Now What?,"My family remains a bit lost as we figure out what to do post-midterms. Our 11-year-old who remained involved throughout the midterms is ready to move on. In the car the other day, she nudged me to find a new hobby.",6,Women Relationships and Health,2014-11-29
Evolving to Survive Ourselves,"As a Taoist monk, I find the notion of the Earth as a superorganism to make perfect sense; I also find the notion of evolution as a propulsive, all-encompassing, and all-pervasive force to be completely congruent with the ancient Chinese concept of Tao.",3,Self Help and Education,2014-07-04
The Ugly Side of Pretty,"Self-absorbed, spoiled, jealous, mean, vapid: these are some of the words that are used to describe models. Now before you",1,Fashion Lifestyle and Travel,2012-10-10
Voting Rights Will Soon Be Restored To Over 1 Million Former Felons In Florida,"Starting at midnight on Tuesday, most former felons in the state who have completed the terms of their sentence can register to vote.",5,US Politics,2019-01-07
The Health Reason You Might Want To Enjoy Pot And Wine Separately,Using alcohol and marijuana together may put you at risk for alcohol-related problems.,3,Self Help and Education,2016-11-03
World’s Saddest Elephant Dies After 60 Years Alone In Her Cell,"Hanako, the world's loneliest elephant, has died.",9,World Events and Society,2016-05-27
The 20 Funniest Tweets From Women This Week,We're here for all the lady Doritos takedowns.,6,Women Relationships and Health,2018-02-09
A Still Mother,"Our beautiful, perfect daughter, Callie Elizabeth Catalino, was born at 8:03 p.m. on May 31, 2011. I whispered to her that I loved her and that I would miss her every day of my life. I asked her to give us strength to continue on, to make it through each minute of our ""new normal.""",8,Family Children and Human Stories,2013-10-15
On Experiencing Fear,,3,Self Help and Education,2014-08-22
What's Really Inside A Chicken Nugget?,"Beyond the obvious gross-out factor, these chicken bits probably aren't particularly harmful, explains David Katz, M.D., founding",4,Food Home and Lifestyle,2013-10-24
Eleven Strategies To Mobilize For Women’s Rights In A Trump Era,The silver lining from the election of Trump is the increased energy and engagement of women as activists and donors. In,6,Women Relationships and Health,2016-12-21
Donald Trump's Secrets and Hypocrisy ... About Golf,"Also, the president has repeatedly been accused of cheating at the game.",7,International Politics,2017-02-20
Gay Marriage's Unexpected Benefits: 3 Good Reasons For Marriage Equality,"Gay marriage not only benefits gay people, it benefits the entire country. More then 14 years ago, states like Colorado passed",6,Women Relationships and Health,2012-12-16
"Kidnapper Beat, Raped Woman For 5 Weeks In Remote Cabin: Cops",The woman says her abductor duct-taped her to his body at night to prevent her from fleeing.,2,Social Issues and Public Safety,2015-11-13
Rudy Giuliani: Obama Was Influenced By Communism At An Early Age,,5,US Politics,2015-02-21
Two Queens On What It's Like To Live And Breathe Drag In Wisconsin And New York,Stephanie Stone and Toyota Corona talk queer culture in two very different parts of America.,6,Women Relationships and Health,2017-10-06
What Won’t Change In 20 Years?,"For entrepreneurs, understanding what is constant and what is changing can give you an enormous competitive edge on those who don't.",3,Self Help and Education,2016-07-03
Rutgers University Stabbings Leaves 3 Injured,A suspect was also injured and taken into custody.,2,Social Issues and Public Safety,2016-11-04
Small Parties Claim Their Share In Upcoming Greek Elections,Some of the country's lesser-known political players believe they've spotted their chance.,5,US Politics,2015-09-15
Jimmy Kimmel Premieres 'Baby Bachelor In Paradise' After 'Bachelerotte' Finale,"The most relatable ""Bachelor"" series yet.",0,Entertainment and Celebrities,2017-08-08
Georgia Governor Vetoes Private Probation Bill,"The bill would have allowed these private probation companies to shield details of their practices from public eyes, while still raking in millions from those they're meant to supervise.",2,Social Issues and Public Safety,2014-05-01
The New Hypertension Guidelines: Should We Let Up on Blood Pressure Control?,"I believe there is an epidemic of overtreatment, but not because the blood pressure level that we aim for is too low. The current targets have a fabulously successful track record; they should not be abandoned.",9,World Events and Society,2014-02-09
Is It Safe To Exercise Twice A Day?,"""A highly conditioned world class athlete would be able to safely hand multiple training sessions in one day,"" says Greatist",3,Self Help and Education,2013-07-05
Judge to Allow Prior Abuse Allegations in Marissa Alexander Trial,,2,Social Issues and Public Safety,2014-11-15
Will the Church Fail or Fulfill Martin Luther King Jr's Legacy?,"In a world that considers cathedrals of stone and even the pulpit where Dr. King spoke irrelevant, what is the future of the church?  We must come out of our pulpits and into the streets, into the gaps of broken relationship and broken trust.  We must do the hard and beautiful work of building the beloved community.",6,Women Relationships and Health,2015-01-18
Jimmy Fallon Tees Off On PGA Golfers,,0,Entertainment and Celebrities,2014-08-13
5 Reasons You Don't Like Spring and How to Readjust,"However you're feeling about the change of season, you're likely guided by more than the flip of your paper calendar. Your emotional calendar greatly influences the changes in you as the seasons shift.",3,Self Help and Education,2012-04-11
'Sweet Caroline' Parody Celebrates Parents' Precious Bathroom Time,"""Hiding never felt so good.""",8,Family Children and Human Stories,2016-09-22
An Educated Consumer Is the Best Customer... Even in a Hospital Setting,Organ donation is an important part of our giving back to those who are awaiting a functioning organ when our bodies no longer have need of those organs. It is also a very individual and private decision that one should consider while one is still healthy.,3,Self Help and Education,2013-07-15
"Your Ultimate Guide To Staying Beautiful While Traveling By Plane, Car, Train And Even Boat","Taking the night train? Wash off all your makeup. Washing your face before bedtime, whether on a train or not, has less to",3,Self Help and Education,2013-11-21
Jon Stewart To Receive Mark Twain Prize For American Humor,"The former host of ""The Daily Show"" is the latest recipient of the Mark Twain prize for lifetime achievement in comedy.",0,Entertainment and Celebrities,2022-04-24
Hard Not to See Bias in Michael Sam's Draft Fall,"In today's NFL full of pass-happy offenses and hybrid defensive fronts, football reasons alone can't justify why an award-winning pass-rusher like Sam fell so far in the draft.",2,Social Issues and Public Safety,2014-05-12
Mayan Apocalypse 2012: A Visit To Tikal (PHOTOS),The site is impressive not just because it is big -- it is large enough that I got lost for a good half an hour without running,1,Fashion Lifestyle and Travel,2012-12-17
You Won't Believe North Korean Cheerleaders' New Obsession On 'Jimmy Kimmel',A certain someone has global appeal in comedy bit.,0,Entertainment and Celebrities,2018-02-14
"Police Sergeant, Suspect Killed In New York Shootout",Another officer was injured amid gunfire in the Bronx.,2,Social Issues and Public Safety,2016-11-04
"A New Year, A New Way to Exercise With Your Dog","It's early in the New Year, and no doubt many have vowed to exercise and get into shape. But do you look at your dog and feel guilty that you're working out instead of playing with him? How about incorporating your dog into a cardio, calorie-burning workout?",3,Self Help and Education,2013-01-11
Resume Soufflé,"I received an email from a gentleman widely regarded as one of the world's foremost resume experts.""Now how do I say this diplomatically? Your resume really sucks."" The comment didn't just sting. I felt like one of the victims on an episode of CSI.",7,International Politics,2012-02-12
A Permanent Solution to a Temporary Problem,,9,World Events and Society,2015-04-22
The Art of Blending Wines: From Barrel to Bottle (VIDEO),Vineyard owner and winemaker James Frey is perfecting the art of blending wine.,1,Fashion Lifestyle and Travel,2013-06-03
'Queer Eye' Is Back And It's Just As Fabulous As You Remember It,Get ready for the Fab Five to restyle and revamp a new generation.,0,Entertainment and Celebrities,2018-01-17
Making Eyebrows in the Water,"This Inuit ritual is another indigenous instruction for the great care and attention needed to see through to the essential realm of spirit that underlies everything. Though even when sighting what matters briefly, there is no guarantee that the deeper reality will surface in the same place twice.",3,Self Help and Education,2012-10-30
Part III: Trauma Training Should Be Mandatory for Yoga Teachers,Don't insist a student take a pose s/he doesn't want to do. Don't ask twice. Respect your students' body wisdom. Become unattached to that teacher/student hierarchy. Teach your students to trust themselves. That's how they'll make friends with their bodies. That's how they'll heal.,3,Self Help and Education,2013-06-17
"Don't Be Scared, It's Just Shrimp: How To Clean, Cook And Enjoy",Certain ingredients just stress people out.,4,Food Home and Lifestyle,2013-04-26
Opinions On Barack Obama's Economic Legacy Don't Have Much To Do With The Economy,Views are once again divided along partisan lines.,5,US Politics,2016-05-10
"Mexico Obesity Rate Higher Than U.S., Says U.N. Report",And now some more news: Mexico has surpassed the U.S. in terms of obese and overweight residents. The new data comes from,9,World Events and Society,2013-07-09
15 Pranks They Never Saw Coming (GIFS),The most important part of any prank is the element of surprise. These 15 clever individuals were able to pull off some crazy,0,Entertainment and Celebrities,2013-07-14
Chillest Dad Ever Catches Baseball One-Handed While Holding Daughter,Put him in the outfield!,8,Family Children and Human Stories,2016-06-18
'Walking Dead' Star Quits Social Media After Frightening Death Threats,"""When you start saying you hope I die, I don’t know if you’re talking about Josh or Eugene.""",0,Entertainment and Celebrities,2017-05-03
Here's What It'd Be Like If 'Full House' Was 'True Detective',"Murder? Sex? Crime? You got it, dude.",2,Social Issues and Public Safety,2016-03-03
Tragedy in a Community: The Balance of Support and Privacy,When tragedy strikes it is our natural spirit to want to do something to manage our own feelings of helplessness and compassion. But perhaps in addition to what we do we need to focus on what we don't do as well.,3,Self Help and Education,2013-06-17
41 Times The Internet Nailed How You Feel About Thanksgiving,Can we eat yet?! 🍗🍖,4,Food Home and Lifestyle,2015-11-17
Cheating in Athletics: The Real Cost of (a Lack of) Trust,"It goes beyond the dollars lost in endorsements to the broken families and friendships, and the derailed careers. The very integrity of our ""heroes"" and the games they play is sometimes called into question.",3,Self Help and Education,2015-06-10
'My Mother Has Been By My Side and Has Had Faith in Me When I Had No Faith in Myself' -- 20 Questions for Women in Construction,"People believe that we are here to fill a quota, not to do a job. When they see that you CAN do what you were sent here to do, they begin to respect you.",6,Women Relationships and Health,2013-03-02
A Filmmaker's Battle To Expose The Broken Promise Of Women's Rights In Afghanistan,"""Maybe I should give you to an Afghan man to take your nose off,"" one lawmaker told the filmmaker.",6,Women Relationships and Health,2016-04-07
5 Secrets Every Fiancée Needs To Know (But No One Tells You!),"Watching the Olympics is a good reminder that when done well, people make very difficult things look easy.  That's often the truth with beautiful weddings.",1,Fashion Lifestyle and Travel,2012-08-10
How Ebola Spreads,"If someone with Ebola sneezes and you get snot on your arm, then you have had direct contact with the virus. If someone sneezes in the room with you, and you do not get sneezed on directly, you wouldn't be exposed.",9,World Events and Society,2014-10-23
‘Nobody Speak’: How Billionaires Are Silencing the First Amendment,"When documentary filmmaker Brian Knappenberger set out to make a film about Hulk Hogan’s lawsuit against Gawker Media, he",7,International Politics,2017-07-22
"North Korea Tests New Anti-Aircraft System, State News Agency Says",KCNA said Kim Jong Un supervised the test.,9,World Events and Society,2017-05-28
Brian Stelter Gives Upside Down Blizzard Report,,9,World Events and Society,2015-01-27
"The Center's Mike Thompson Says 'P.S., I Love You Because...'","In recent months, for a variety of media outlets, I've been thrilled to interview people about why they love my hometown of Palm Springs, California, hence the headline, ""P.S., I Love You Because...""",0,Entertainment and Celebrities,2014-11-07
"This Week in World War I October 24-31, 1914",,9,World Events and Society,2014-10-26
Syria's Tourism Minister Thinks Business Will Be Booming,,9,World Events and Society,2014-05-05
The Toddler Council's Official Statement On The Royal Baby,"To the general public, please remember that it is not your job to watch news reports about a baby that may or may not be real. Your job is to pay attention to the toddler in your life.",8,Family Children and Human Stories,2013-07-23
Twitter Thread Nails The More Subtle Symptoms Of Mental Health Conditions,"""For me, it's the amount of dishes in my sink.""",3,Self Help and Education,2019-02-28
GPS Guide: Dr. Frank Niles Finds His Center,The stress and strain of constantly being connected can sometimes take your life -- and your well-being -- off course. GPS,3,Self Help and Education,2012-12-27
Artist Pays Latino Day Workers Hourly Wage To Sit For A Portrait,John Sonsini's quiet rebellion against #ArtHistorySoWhite.,2,Social Issues and Public Safety,2016-02-11
Ricky Gervais: Donald Trump Is More David Brent Than JFK,"The comedian said the GOP nominee's campaign is ""like a joke that got out of hand.""",7,International Politics,2016-10-23
Why We Shouldn't Lose Sight of Full Equality,"Whether at school or in public spaces, many LGBT youth don't feel safe and continue to face disgraceful levels of discrimination (and some don't feel safe at home, either). But when they enter the workforce, disadvantages persist.",6,Women Relationships and Health,2014-10-27
Stressed About Your Sleep? This Perspective Could Help,,3,Self Help and Education,2014-11-13
The Political Revolution Is Close To Fruition In Oregon,Democratic Gov. Kate Brown has advanced a slew of progressive priorities since she took office last year.,5,US Politics,2016-02-24
How to End Breast Cancer: A Request,"In what seems like a previous lifetime, I was a congressional lobbyist in Washington. I might as well draw on that knowledge for something, right?",5,US Politics,2013-10-31
Exploring Singapore's Café Culture In 24 Hours,"While most people spend their layover in Singapore scrambling to hit well-known hawker stands, I chose to sip lattes and gnash on gourmet vegetarian cuisine at some of the city's coolest cafés.",4,Food Home and Lifestyle,2012-09-18
German Mayoral Candidate Stabbed In Anti-Refugee Attack,BERLIN (AP) — A leading candidate to be mayor of Cologne was stabbed and seriously wounded Saturday by a man who claimed,2,Social Issues and Public Safety,2015-10-17
5 Trips To Book After A Breakup,"After all, no one ever said a broken heart would be easy, but it doesn't have to be boring. And while the thought of being",3,Self Help and Education,2013-12-06
'A' Is For Asexual: Erasing The Asexual Orientation,"""Guess what, Equinox? Videos like yours that erase Asexuality from the equation completely just perpetuate a system where young Asexuals continue feeling 'broken.'""",6,Women Relationships and Health,2017-06-17
6 Ways to Do Turtlenecks Right,"To tuck or not to tuck, that is the question.",3,Self Help and Education,2014-03-03
The Ultimate 'Game of Thrones' Baby Name,"Plenty of authors dating back to Shakespeare have invented names that caught on with parents. But a name taken from a word that's not a name, from an imagined language? I can't think of a precedent.",8,Family Children and Human Stories,2013-05-22
SC State Rep: I'll Introduce Legislation To Remove Confederate Flag,,2,Social Issues and Public Safety,2015-06-20
Husky Can't Stop Blowing Bubbles; We Can't Stop Saying Awww,"Gurgle, gurgle, gurgle",0,Entertainment and Celebrities,2016-06-08
Not Just The Flu,Rolin Baker's family says he died of the coronavirus two weeks ago. They haven't been able to grieve together.,9,World Events and Society,2020-04-12
The Best Top You Didn't Know About,,0,Entertainment and Celebrities,2014-05-25
Leo Varadkar To Become Ireland's First Openly Gay Prime Minister,The 38-year-old son of an Indian immigrant will be the youngest person to hold office.,6,Women Relationships and Health,2017-06-02
Lena Dunham Apologizes For 'Distasteful' Abortion Remark,"""My words were spoken from a sort of 'delusional girl' persona.""",6,Women Relationships and Health,2016-12-21
Mariah Carey To Star In A Series For E!,"The Kardashians, Caitlyn Jenner and the female wrestlers of “Total Divas” will welcome a new neighbor to the E! lineup later",0,Entertainment and Celebrities,2016-03-17
"Mia Love Will Repay Taxpayers For $1,000 In Flights",She flew to D.C. for the White House Correspondents' Dinner.,7,International Politics,2015-09-04
"President's Day: 50 States, 50 Presidential Sites (PHOTOS)",Presidents Day: that strategic February Monday holiday in the U.S. that's situated at arm's length between George Washington's,7,International Politics,2012-02-16
"Democracy In Cuba Must Be Homegrown, Not Midwifed By Washington","Notwithstanding the actions taken on December 17, we will not have an effective Cuba policy until these questions about a future Cuban democracy are answered.",5,US Politics,2015-01-09
New 'SNL' Comic James Austin Johnson Is 'Best Trump Impersonator.' See Why.,"Johnson, officially announced as a new cast member before Saturday's 47th season premiere, has been lauded as a pitch-perfect impressionist of the ex-president.",0,Entertainment and Celebrities,2021-09-28
Here’s What Could Happen With Roy Moore And The Alabama Senate Ballot,Here are four different scenarios for Moore and the Republican Party.,5,US Politics,2017-11-09
3 Skincare Crimes I Know You're Guilty of Committing,Remember when your mother used to say you're only hurting yourself? That's right. Committing these skincare crimes is just making things worse for your skin. Our poor skin doesn't need a magical elixir or potion; it just needs a little TLC and SPF.,2,Social Issues and Public Safety,2013-03-19
Allies Form Human Chain Around Muslims Praying During Travel Ban Protest,"“It’s what we should do as Americans,"" said Rev. Dr. Chloe Breyer, executive director of the Interfaith Center of New York.",2,Social Issues and Public Safety,2018-01-27
5 Things Customers May Not Tell You Before They Leave for Good,"If you've never hired secret shoppers for yourself, here are some common messages they have to communicate to their clients. Are these same issues persuading your own customers to walk away without leaving clues?",4,Food Home and Lifestyle,2014-06-09
HuffPost Rise: What You Need To Know On March 11,"Welcome to the HuffPost Rise Morning Newsbrief, a short wrap-up of the news to help you start your day.",5,US Politics,2016-03-11
"Journalists Condemn Trump Press Restrictions, But Don't Expect Them To Boycott Briefings","""They don’t want the American public to see this live,” CNN's Wolf Blitzer said as video coverage is again barred.",7,International Politics,2017-06-22
